{"$schema":"http://json-schema.org/draft-07/schema#","title":"Template","type":"object","required":["description","name","resources","runtime","saveables","template-format","variables"],"properties":{"author":{"description":"Simple identifier of the author.","type":["string","null"]},"description":{"description":"Longer description of the template.\n\nExample: \"Server running vanilla Minecraft 1.12.2\"","type":"string"},"name":{"description":"Name of the template. The name should briefly describe and identify the template.\n\nExample: \"1.12.2 Vanilla\"","type":"string"},"resources":{"description":"List of additional resources (e.g. plugins, mods, configs, etc.)","type":"array","items":{"$ref":"#/definitions/GenericResource"}},"runtime":{"description":"Server runtime software.","allOf":[{"$ref":"#/definitions/ServerRuntimeResource"}]},"saveables":{"description":"List of files which should be saved (e.g. worlds, whitelists, etc.)","type":"array","items":{"type":"string"}},"template-format":{"type":"integer","format":"uint","minimum":0.0},"variables":{"description":"Variables neccessary for the template.","type":"array","items":{"$ref":"#/definitions/Var"}},"version":{"description":"Version of the template.","type":["array","null"],"items":[{"type":"integer","format":"uint64","minimum":0.0},{"type":["integer","null"],"format":"uint64","minimum":0.0},{"type":["integer","null"],"format":"uint64","minimum":0.0}],"maxItems":3,"minItems":3}},"definitions":{"ArchiveFormat":{"type":"string","enum":["tar.gz","zip"]},"ArchiveInfo":{"type":"object","required":["format","internal-path","post-remove"],"properties":{"format":{"$ref":"#/definitions/ArchiveFormat"},"internal-path":{"type":"string"},"post-remove":{"description":"Paths to remove after extraction (relative to the new directory)","type":"array","items":{"type":"string"}}}},"GenericResource":{"oneOf":[{"description":"A remote file to download via provided URL","type":"object","required":["remote"],"properties":{"remote":{"type":"object","required":["template-path","url"],"properties":{"archive":{"description":"If the remote file is an archive, define the internal object to extract and the archive format","anyOf":[{"$ref":"#/definitions/ArchiveInfo"},{"type":"null"}]},"override-name":{"description":"Optional name of the remote file","type":["string","null"]},"sha512":{"description":"Optional SHA-512 hash of the remote file for verification","type":["string","null"]},"template-path":{"description":"Path the file should be written to inside the build","type":"string"},"url":{"description":"URL of the remote file","type":"string"},"use-variables":{"description":"Whether to use variables in the file","anyOf":[{"$ref":"#/definitions/VarFormat"},{"type":"null"}]},"user-agent":{"description":"Custom user agent to use for the download","type":["string","null"]}}}},"additionalProperties":false},{"description":"A file encoded with Base64","type":"object","required":["base64"],"properties":{"base64":{"type":"object","required":["base64","template-path"],"properties":{"base64":{"type":"string"},"template-path":{"description":"Path the file should be written to inside the build","type":"string"},"use-variables":{"description":"Whether to use variables in the file","anyOf":[{"$ref":"#/definitions/VarFormat"},{"type":"null"}]}}}},"additionalProperties":false},{"description":"Copy file from Volkanic include folder to template","type":"object","required":["include"],"properties":{"include":{"type":"object","required":["id","template-path"],"properties":{"id":{"type":"string"},"template-path":{"description":"Path the file should be written to inside the build","type":"string"},"use-variables":{"description":"Whether to use variables in the file","anyOf":[{"$ref":"#/definitions/VarFormat"},{"type":"null"}]}}}},"additionalProperties":false}]},"ServerRuntimeResource":{"oneOf":[{"type":"object","required":["jdk"],"properties":{"jdk":{"type":"object","required":["jar-path","jdk-args","server-args","version"],"properties":{"jar-path":{"description":"Path to JAR executable","type":"string"},"jdk-args":{"description":"Adds additional JDK arguments","type":"array","items":{"type":"string"}},"server-args":{"description":"Adds additional arguments for JAR executable","type":"array","items":{"type":"string"}},"version":{"type":"string"}}}},"additionalProperties":false}]},"Var":{"oneOf":[{"type":"object","required":["static"],"properties":{"static":{"type":"object","required":["name","value"],"properties":{"name":{"type":"string"},"value":{"type":"string"}}}},"additionalProperties":false},{"type":"object","required":["user"],"properties":{"user":{"type":"object","required":["name"],"properties":{"default":{"type":["string","null"]},"name":{"type":"string"}}}},"additionalProperties":false}]},"VarFormat":{"type":"string","enum":["dollar-curly"]}}}