{
  "template-format": 3,
  "name": "1.21.4 Paper",
  "description": "Server running Minecraft 1.21.4 with PaperMC",
  "author": "VolkanicMC",
  "version": [
    1,
    0,
    0
  ],
  "variables": [
    {
      "user": {
        "name": "PORT",
        "default": "25565"
      }
    },
    {
      "user": {
        "name": "MC_RESOURCES",
        "default": ""
      }
    },
    {
      "user": {
        "name": "MC_RESOURCES_SHA1",
        "default": ""
      }
    }
  ],
  "runtime": {
    "jdk": {
      "version": "21",
      "jar-path": "server.jar",
      "jdk-args": [
        "-XX:+AlwaysPreTouch",
        "-XX:+DisableExplicitGC",
        "-XX:+ParallelRefProcEnabled",
        "-XX:+PerfDisableSharedMem",
        "-XX:+UnlockExperimentalVMOptions",
        "-XX:+UseG1GC",
        "-XX:G1HeapRegionSize=8M",
        "-XX:G1HeapWastePercent=5",
        "-XX:G1MaxNewSizePercent=40",
        "-XX:G1MixedGCCountTarget=4",
        "-XX:G1MixedGCLiveThresholdPercent=90",
        "-XX:G1NewSizePercent=30",
        "-XX:G1RSetUpdatingPauseTimePercent=5",
        "-XX:G1ReservePercent=20",
        "-XX:InitiatingHeapOccupancyPercent=15",
        "-XX:MaxGCPauseMillis=200",
        "-XX:MaxTenuringThreshold=1",
        "-XX:SurvivorRatio=32",
        "-Dusing.aikars.flags=https://mcflags.emc.gs",
        "-Daikars.new.flags=true"
      ],
      "server-args": ["-nogui"]
    }
  },
  "resources": [
    {
      "remote": {
        "url": "https://api.papermc.io/v2/projects/paper/versions/1.21.4/builds/225/downloads/paper-1.21.4-225.jar",
        "sha512": "1e82f665cc342ef05b5231eb2609b99d0b438ef929b5313a0f4d50e5373ae504b6bcda53054c7e91930d62b2e3f7ed1710b2616f3bf6a435a191a628cc6bddd5",
        "template-path": "server.jar"
      }
    },
    {
      "include": {
        "id": "1-21-paper.properties",
        "use-variables": "dollar-curly",
        "template-path": "server.properties"
      }
    },
    {
      "include": {
        "id": "eula.txt",
        "template-path": "eula.txt"
      }
    }
  ],
  "saveables": [
    "logs/",
    "world/",
    "world_nether/",
    "world_the_end/",
    ".console_history",
    "banned-ips.json",
    "banned-players.json",
    "ops.json",
    "permissions.yml",
    "usercache.json",
    "version_history.json",
    "whitelist.json"
  ]
}
